fecha,titular,url_archivo
20250118,Arrested president’s supporters look west to ‘make Korea great again’,https://web.archive.org/web/20250118235847/https://www.thetimes.com/
20250118,Navalny’s defence lawyers jailed on ‘extremism’ charges,https://web.archive.org/web/20250118235847/https://www.thetimes.com/
20250118,US politics,https://web.archive.org/web/20250118235847/https://www.thetimes.com/
20250118,What will Trump do now? Expect ‘shock and awe’ from day one,https://web.archive.org/web/20250118235847/https://www.thetimes.com/
20250118,Inauguration moved indoors due to subzero cold,https://web.archive.org/web/20250118235847/https://www.thetimes.com/
20250118,"Days before Trump’s inauguration, where does the Biden presidency rank?",https://web.archive.org/web/20250118235847/https://www.thetimes.com/
20250118,Mark Burnett: from The Apprentice to Trump’s UK special envoy,https://web.archive.org/web/20250118235847/https://www.thetimes.com/
20250118,Trump picks assassination bodyguard to lead Secret Service,https://web.archive.org/web/20250118235847/https://www.thetimes.com/
20250118,The Obamas show unity amid rumours of marriage trouble,https://web.archive.org/web/20250118235847/https://www.thetimes.com/
20250118,Liz Truss to attend Trump’s swearing-in — who else is going?,https://web.archive.org/web/20250118235847/https://www.thetimes.com/
20250118,"Biden commutes nearly 2,500 drug offenders’ sentences",https://web.archive.org/web/20250118235847/https://www.thetimes.com/
20250118,"As France breaks less bread, the US develops a taste for its flour",https://web.archive.org/web/20250118235847/https://www.thetimes.com/
20250118,ICC prosecutor meets new leader of Syria,https://web.archive.org/web/20250118235847/https://www.thetimes.com/
20250118,Bezos’s Blue Origin blasts into orbit,https://web.archive.org/web/20250118235847/https://www.thetimes.com/
20250118,Imran Khan jailed for 14 years in corruption case,https://web.archive.org/web/20250118235847/https://www.thetimes.com/
20250118,Comment,https://web.archive.org/web/20250118235847/https://www.thetimes.com/
20250118,"Starmer must decide, is he politician or lawyer?",https://web.archive.org/web/20250118235847/https://www.thetimes.com/
20250118,Finally some sense on Whitehall gender policy,https://web.archive.org/web/20250118235847/https://www.thetimes.com/
20250118,It’s a hard life but I’ve managed to make it work,https://web.archive.org/web/20250118235847/https://www.thetimes.com/
20250118,Starmer’s next phase will be put to the test amid ‘scorpion death fight’,https://web.archive.org/web/20250118235847/https://www.thetimes.com/
20250118,Iranian film is a brave and funny slice of life,https://web.archive.org/web/20250118235847/https://www.thetimes.com/
20250118,It’s Trump: the sequel and this time his revolution may succeed,https://web.archive.org/web/20250118235847/https://www.thetimes.com/
20250118,What new oligarchs can learn from the old,https://web.archive.org/web/20250118235847/https://www.thetimes.com/
20250118,"That’s not all, folks — the return of the film intermission",https://web.archive.org/web/20250118235847/https://www.thetimes.com/
20250118,On the tail of Britain’s disappearing chaffinches,https://web.archive.org/web/20250118235847/https://www.thetimes.com/
20250118,Calls for Reeves to reverse her tax blunder,https://web.archive.org/web/20250118235847/https://www.thetimes.com/
20250118,Daily Universal Register,https://web.archive.org/web/20250118235847/https://www.thetimes.com/
20250118,Sponsored,https://web.archive.org/web/20250118235847/https://www.thetimes.com/
20250118,Business,https://web.archive.org/web/20250118235847/https://www.thetimes.com/
20250118,Spending freeze to shunt major railway projects past general election,https://web.archive.org/web/20250118235847/https://www.thetimes.com/
20250118,Trump will roll back diversity targets. The UK must follow suit,https://web.archive.org/web/20250118235847/https://www.thetimes.com/
20250118,Cut red tape and embrace risk to fire Britain’s animal spirits,https://web.archive.org/web/20250118235847/https://www.thetimes.com/
20250118,Everyone bashes it but BA is surging ahead … what’s its secret?,https://web.archive.org/web/20250118235847/https://www.thetimes.com/
20250118,FTSE 100 closes at record high on rate cut hopes,https://web.archive.org/web/20250118235847/https://www.thetimes.com/
20250118,"Reforms to boost growth will bring risks and failures, warns FCA",https://web.archive.org/web/20250118235847/https://www.thetimes.com/
20250118,"UK economy will outdo Germany, France and Italy, predicts IMF",https://web.archive.org/web/20250118235847/https://www.thetimes.com/
20250118,TikTok could be saved in the nick of time —using the art of the deal,https://web.archive.org/web/20250118235847/https://www.thetimes.com/
20250118,TDR starts turnaround plan for Asda after tough Christmas,https://web.archive.org/web/20250118235847/https://www.thetimes.com/
20250118,Abu Dhabi fund ‘urges Telegraph executives to make job cuts’,https://web.archive.org/web/20250118235847/https://www.thetimes.com/
20250118,UK banks win delay to Basel 3.1 rules,https://web.archive.org/web/20250118235847/https://www.thetimes.com/
20250118,Anyone who thinks growth is a sure thing may be in for a shock,https://web.archive.org/web/20250118235847/https://www.thetimes.com/
20250118,Potential Rio Tinto-Glencore merger ‘a clash of cultures’,https://web.archive.org/web/20250118235847/https://www.thetimes.com/
20250118,Queen of the New York skyline: ‘Things are going to get easier’,https://web.archive.org/web/20250118235847/https://www.thetimes.com/
20250118,Octopus Energy overtakes British Gas as UK’s largest supplier,https://web.archive.org/web/20250118235847/https://www.thetimes.com/
20250118,US nuclear upgrade could be blueprint for power stations in Britain,https://web.archive.org/web/20250118235847/https://www.thetimes.com/
20250118,Falling retail sales highlight fragility of the economy,https://web.archive.org/web/20250118235847/https://www.thetimes.com/
20250118,Smiths Group faces calls to be broken up and sold,https://web.archive.org/web/20250118235847/https://www.thetimes.com/
20250118,Guardian staff ‘deeply disturbed’ over AI use during strike,https://web.archive.org/web/20250118235847/https://www.thetimes.com/
20250118,The Times Enterprise Network,https://web.archive.org/web/20250118235847/https://www.thetimes.com/
20250118,Make your pitch to Richard Branson — and cut the waffle,https://web.archive.org/web/20250118235847/https://www.thetimes.com/
20250118,UK business closures hit 20-year high,https://web.archive.org/web/20250118235847/https://www.thetimes.com/
20250118,‘It seemed wrong not to share my home with others’,https://web.archive.org/web/20250118235847/https://www.thetimes.com/
20250118,Confusion over employment allowance ‘puts small firms at risk’,https://web.archive.org/web/20250118235847/https://www.thetimes.com/
20250118,Don’t let AI hire your staff,https://web.archive.org/web/20250118235847/https://www.thetimes.com/
20250118,You could become part of a shift in the fashion industry,https://web.archive.org/web/20250118235847/https://www.thetimes.com/
20250118,‘People will trust a company that supports its local community’,https://web.archive.org/web/20250118235847/https://www.thetimes.com/
20250118,Sunday Times 100 Tech,https://web.archive.org/web/20250118235847/https://www.thetimes.com/
20250118,100 fastest-growing tech companies in Britain revealed,https://web.archive.org/web/20250118235847/https://www.thetimes.com/
20250118,My £100 billion plan to power Britain’s brightest minds,https://web.archive.org/web/20250118235847/https://www.thetimes.com/
20250118,The UK’s investment minister: How Britain will become a tech powerhouse,https://web.archive.org/web/20250118235847/https://www.thetimes.com/
20250118,Looking for a £70k-plus job? These UK firms are hiring,https://web.archive.org/web/20250118235847/https://www.thetimes.com/
20250118,My engineering career took me from RAF spy planes to Big Tech data,https://web.archive.org/web/20250118235847/https://www.thetimes.com/
20250118,The female-led start-ups who have raised £190m between them,https://web.archive.org/web/20250118235847/https://www.thetimes.com/
20250118,‘I grew a £20m military tech company without venture capital’,https://web.archive.org/web/20250118235847/https://www.thetimes.com/
20250118,How this woman is leading the next biotech revolution,https://web.archive.org/web/20250118235847/https://www.thetimes.com/
20250118,What it takes to make The Sunday Times 100 Tech list,https://web.archive.org/web/20250118235847/https://www.thetimes.com/
20250118,The Sunday Times 100 Tech,https://web.archive.org/web/20250118235847/https://www.thetimes.com/
20250118,Sport,https://web.archive.org/web/20250118235847/https://www.thetimes.com/
20250118,Watkins delivers latest blow to Arsenal as Arteta admits Saliba ‘concern’,https://web.archive.org/web/20250118235847/https://www.thetimes.com/
20250118,Haaland makes City worse — they deserve more for their money,https://web.archive.org/web/20250118235847/https://www.thetimes.com/
20250118,Boffins or blaggers? The rise and rise of the sporting director,https://web.archive.org/web/20250118235847/https://www.thetimes.com/
20250118,Chessum: Leicester letting me go as a kid was best thing that happened to me,https://web.archive.org/web/20250118235847/https://www.thetimes.com/
20250118,Super-sub Núñez’s stoppage-time double rescues wasteful Liverpool,https://web.archive.org/web/20250118235847/https://www.thetimes.com/
20250118,Why British stars are flocking to Italy for a career renaissance,https://web.archive.org/web/20250118235847/https://www.thetimes.com/
20250118,Gatland: You could take a real crack at older guys — my language has softened,https://web.archive.org/web/20250118235847/https://www.thetimes.com/
20250118,Eubank and Benn controversies make Sky reluctant to show fight,https://web.archive.org/web/20250118235847/https://www.thetimes.com/
20250118,Smith or Steward at full back? New kicking laws could solve Borthwick’s dilemma,https://web.archive.org/web/20250118235847/https://www.thetimes.com/
20250118,‘I’ve never lost a fight in my life’ — meet Britain’s next heavyweight superstar,https://web.archive.org/web/20250118235847/https://www.thetimes.com/
20250118,How women’s football in England became so middle class and white,https://web.archive.org/web/20250118235847/https://www.thetimes.com/
20250118,Why has it taken England so long to make Itoje captain?,https://web.archive.org/web/20250118235847/https://www.thetimes.com/
20250118,United play best as underdogs — it’s time for them to embrace it,https://web.archive.org/web/20250118235847/https://www.thetimes.com/
20250118,Saints hold on to claim home tie — but Mitchell limps off before Six Nations,https://web.archive.org/web/20250118235847/https://www.thetimes.com/
20250118,Snyman-inspired Leinster send Bath crashing out after Obano red,https://web.archive.org/web/20250118235847/https://www.thetimes.com/
20250118,Smith shows why he should be England’s No10 by guiding Quins into last 16,https://web.archive.org/web/20250118235847/https://www.thetimes.com/
20250118,Scotland captain Tuipulotu doubt for Six Nations after injury,https://web.archive.org/web/20250118235847/https://www.thetimes.com/
20250118,‘Poise of ballet dancer’ — what it was like to play with Law,https://web.archive.org/web/20250118235847/https://www.thetimes.com/
20250118,I grew up with legend of Law and saw his role in Fergie’s Aberdeen fairytale,https://web.archive.org/web/20250118235847/https://www.thetimes.com/
20250118,Kluivert hat-trick brings Newcastle crashing back down to earth,https://web.archive.org/web/20250118235847/https://www.thetimes.com/
20250118,Mateta’s brace shows Potter scale of his task at listless West Ham,https://web.archive.org/web/20250118235847/https://www.thetimes.com/
20250118,Dele Alli to sign Como deal in bid to get career back on track under Fàbregas,https://web.archive.org/web/20250118235847/https://www.thetimes.com/
20250118,Rob Wright’s Sunday racing tips,https://web.archive.org/web/20250118235847/https://www.thetimes.com/
20250118,Sponsored,https://web.archive.org/web/20250118235847/https://www.thetimes.com/
20250118,Money,https://web.archive.org/web/20250118235847/https://www.thetimes.com/
20250118,Will reforms be the final nail in the coffin for landlords?,https://web.archive.org/web/20250118235847/https://www.thetimes.com/
20250118,British bonds are going cheap. Maybe it’s time to buy some,https://web.archive.org/web/20250118235847/https://www.thetimes.com/
20250118,How to get the best deal on your holiday cash,https://web.archive.org/web/20250118235847/https://www.thetimes.com/
20250118,Should parents let adult children live at home rent-free?,https://web.archive.org/web/20250118235847/https://www.thetimes.com/
20250118,Parking fines: when to appeal and how to avoid getting scammed,https://web.archive.org/web/20250118235847/https://www.thetimes.com/
20250118,SSE isn’t my energy company — but it still sent a debt collector,https://web.archive.org/web/20250118235847/https://www.thetimes.com/
20250118,I’m a novice investor — where should I start?,https://web.archive.org/web/20250118235847/https://www.thetimes.com/
20250118,The Times Magazine,https://web.archive.org/web/20250118235847/https://www.thetimes.com/
20250118,Harriet Walter: ‘A love affair when you’re older is difficult’,https://web.archive.org/web/20250118235847/https://www.thetimes.com/
20250118,Ben and Georgie Ainslie: ‘Infertility pushed us over the edge’,https://web.archive.org/web/20250118235847/https://www.thetimes.com/
20250118,What’s it like to be estranged from your family?,https://web.archive.org/web/20250118235847/https://www.thetimes.com/
20250118,Never mind Trad Wives. Where are all the Trad Husbands?,https://web.archive.org/web/20250118235847/https://www.thetimes.com/
20250118,I’m an older woman who dates younger men. Here’s what it’s like,https://web.archive.org/web/20250118235847/https://www.thetimes.com/
20250118,"Trump, the sequel",https://web.archive.org/web/20250118235847/https://www.thetimes.com/
20250118,"Team Trump: who’s in, who’s out — the new power list",https://web.archive.org/web/20250118235847/https://www.thetimes.com/
20250118,"Republican style is back: bare legs, short skirts, blondes, heels",https://web.archive.org/web/20250118235847/https://www.thetimes.com/
20250118,What the US ambassador saw (and what she thinks of Trump and Biden),https://web.archive.org/web/20250118235847/https://www.thetimes.com/
20250118,Jessica Reed Kraus: the mommy blogger Donald Trump loves,https://web.archive.org/web/20250118235847/https://www.thetimes.com/
20250118,What do Melania Trump and Usha Vance have in common? Ambition,https://web.archive.org/web/20250118235847/https://www.thetimes.com/
20250118,Anton Du Beke: ‘My father was an alcoholic. I don’t drink’,https://web.archive.org/web/20250118235847/https://www.thetimes.com/
20250118,"Chinese Cricket Club: ‘Bland, generic, loveless’",https://web.archive.org/web/20250118235847/https://www.thetimes.com/
20250118,The only seven Greek recipes you’ll ever need,https://web.archive.org/web/20250118235847/https://www.thetimes.com/
20250118,Does taking the bins out count as manning up?,https://web.archive.org/web/20250118235847/https://www.thetimes.com/
20250118,Saturday Review,https://web.archive.org/web/20250118235847/https://www.thetimes.com/
20250118,Trudie Styler and Sting — a boozy lunch and secrets of their A-list marriage,https://web.archive.org/web/20250118235847/https://www.thetimes.com/
20250118,"My father, the loving monster — the memoir of Gisèle Pelicot’s daughter",https://web.archive.org/web/20250118235847/https://www.thetimes.com/
20250118,Roger Allam on playing Churchill: ‘Voices like mine aren’t in fashion any more’,https://web.archive.org/web/20250118235847/https://www.thetimes.com/
20250118,The Breakthrough shows why Scandi noir and gruesome true crime don’t mix,https://web.archive.org/web/20250118235847/https://www.thetimes.com/
20250118,On the trail of David Bowie — and his favourite haunts,https://web.archive.org/web/20250118235847/https://www.thetimes.com/
20250118,Khloé in Wonder Land — this Kardashian podcast is the most vacuous I have heard,https://web.archive.org/web/20250118235847/https://www.thetimes.com/
20250118,Meet the real gladiators (and the animals who attacked them),https://web.archive.org/web/20250118235847/https://www.thetimes.com/
20250118,Maxine Peake: there are too many films and TV series about male gangs,https://web.archive.org/web/20250118235847/https://www.thetimes.com/
20250118,Kevin Costner at 70 — his 10 greatest roles,https://web.archive.org/web/20250118235847/https://www.thetimes.com/
20250118,Book reviews,https://web.archive.org/web/20250118235847/https://www.thetimes.com/
20250118,‘Who am I to exclude anyone?’ — the Pope’s autobiography is a coded manifesto,https://web.archive.org/web/20250118235847/https://www.thetimes.com/
20250118,The civil war told through two friends: a Cavalier and a Roundhead,https://web.archive.org/web/20250118235847/https://www.thetimes.com/
20250118,Put down your phones! How to live with more feeling and less scrolling,https://web.archive.org/web/20250118235847/https://www.thetimes.com/
20250118,The Mao factor: how Huawei rose to the top,https://web.archive.org/web/20250118235847/https://www.thetimes.com/
20250118,The terrifying prospect of a world without men,https://web.archive.org/web/20250118235847/https://www.thetimes.com/
20250118,Heists and King Herod — and more great historical fiction for January,https://web.archive.org/web/20250118235847/https://www.thetimes.com/
20250118,A novel with a first sentence so good you’ll be hooked straight away,https://web.archive.org/web/20250118235847/https://www.thetimes.com/
20250118,"Hurrah, a book that remembers that teenage boys exist",https://web.archive.org/web/20250118235847/https://www.thetimes.com/
20250118,Going out or staying in? Our critics pick the best things to do this week,https://web.archive.org/web/20250118235847/https://www.thetimes.com/
20250118,The best new songs to listen to this week,https://web.archive.org/web/20250118235847/https://www.thetimes.com/
20250118,The latest news and gossip from the world of TV,https://web.archive.org/web/20250118235847/https://www.thetimes.com/
20250118,Nintendo finally reveals the Switch 2 — here’s what we know,https://web.archive.org/web/20250118235847/https://www.thetimes.com/
20250118,First night reviews,https://web.archive.org/web/20250118235847/https://www.thetimes.com/
20250118,Kyoto is a play that turns a climate conference into gripping theatre,https://web.archive.org/web/20250118235847/https://www.thetimes.com/
20250118,Love Life — an ingenious revival of Kurt Weill’s forgotten musical,https://web.archive.org/web/20250118235847/https://www.thetimes.com/
20250118,Kahchun Wong and the Hallé give us brutal and luminous Mahler,https://web.archive.org/web/20250118235847/https://www.thetimes.com/
20250118,The Employees — this would work better as an art installation,https://web.archive.org/web/20250118235847/https://www.thetimes.com/
20250118,What to watch: your TV and streaming guide,https://web.archive.org/web/20250118235847/https://www.thetimes.com/
20250118,What’s on TV and radio this weekend — Michael McIntyre’s Big Show,https://web.archive.org/web/20250118235847/https://www.thetimes.com/
20250118,The best shows on Prime Video,https://web.archive.org/web/20250118235847/https://www.thetimes.com/
20250118,The best hidden gem TV shows,https://web.archive.org/web/20250118235847/https://www.thetimes.com/
20250118,The best shows on BBC iPlayer,https://web.archive.org/web/20250118235847/https://www.thetimes.com/
20250118,The best shows on Apple TV+,https://web.archive.org/web/20250118235847/https://www.thetimes.com/
20250118,The best shows on ITVX,https://web.archive.org/web/20250118235847/https://www.thetimes.com/
20250118,The best shows on Paramount+,https://web.archive.org/web/20250118235847/https://www.thetimes.com/
20250118,The best shows on Netflix,https://web.archive.org/web/20250118235847/https://www.thetimes.com/
20250118,TV listings,https://web.archive.org/web/20250118235847/https://www.thetimes.com/
20250118,The Times Saturday Quiz,https://web.archive.org/web/20250118235847/https://www.thetimes.com/
20250118,Word Watch,https://web.archive.org/web/20250118235847/https://www.thetimes.com/
20250118,Literary Quiz,https://web.archive.org/web/20250118235847/https://www.thetimes.com/
20250118,Mindset,https://web.archive.org/web/20250118235847/https://www.thetimes.com/
20250118,Weekend,https://web.archive.org/web/20250118235847/https://www.thetimes.com/
20250118,Dr Rangan Chatterjee’s men’s health guide: 12 rules for body and mind,https://web.archive.org/web/20250118235847/https://www.thetimes.com/
20250118,Cooking with kids: top chefs’ favourite recipes,https://web.archive.org/web/20250118235847/https://www.thetimes.com/
20250118,"Lord Sugar: I told my staff, ‘Get back to work. If you don’t like it, sod off!’",https://web.archive.org/web/20250118235847/https://www.thetimes.com/
20250118,Why you’re so tired all the time ­— it may not be lack of sleep,https://web.archive.org/web/20250118235847/https://www.thetimes.com/
20250118,The 20 best wetlands and nature reserves to visit this winter,https://web.archive.org/web/20250118235847/https://www.thetimes.com/
20250118,I can’t stop thinking about his beautiful ex,https://web.archive.org/web/20250118235847/https://www.thetimes.com/
20250118,The best whiskies for Burns Night,https://web.archive.org/web/20250118235847/https://www.thetimes.com/
20250118,Climbing roses: a beginner’s guide to planting and pruning,https://web.archive.org/web/20250118235847/https://www.thetimes.com/
20250118,My jobs to do in the garden in January,https://web.archive.org/web/20250118235847/https://www.thetimes.com/
20250118,Stop the Strava showoffs – slow runners unite!,https://web.archive.org/web/20250118235847/https://www.thetimes.com/
20250118,"A good walk: Crowden Clough, Edale, Peak District National Park",https://web.archive.org/web/20250118235847/https://www.thetimes.com/
20250118,My January ‘jump-start’ HIIT session,https://web.archive.org/web/20250118235847/https://www.thetimes.com/
20250118,I secretly have a favourite child. Don’t most parents?,https://web.archive.org/web/20250118235847/https://www.thetimes.com/
20250118,Travel,https://web.archive.org/web/20250118235847/https://www.thetimes.com/
20250118,The Caribbean island the world forgot about (and why to go now),https://web.archive.org/web/20250118235847/https://www.thetimes.com/
20250118,Why now is the time to visit the Algarve’s secret green corner,https://web.archive.org/web/20250118235847/https://www.thetimes.com/
20250118,The bargain hack to see France’s best region for foodies,https://web.archive.org/web/20250118235847/https://www.thetimes.com/
20250118,‘EasyJet wouldn’t pay for our hotel when we got stuck in Montenegro’,https://web.archive.org/web/20250118235847/https://www.thetimes.com/
20250118,25 under-the-radar stays in the Canary Islands,https://web.archive.org/web/20250118235847/https://www.thetimes.com/
20250118,This buzzy canal district is Milan at its best,https://web.archive.org/web/20250118235847/https://www.thetimes.com/
20250118,17 of the best affordable hotels in Paris under £150,https://web.archive.org/web/20250118235847/https://www.thetimes.com/
20250118,The Swan Inn hotel review: a classic village pub with added froth,https://web.archive.org/web/20250118235847/https://www.thetimes.com/
20250118,This week’s best-value holidays — from cut-price skiing to winter sun,https://web.archive.org/web/20250118235847/https://www.thetimes.com/
20250118,Lake Garda’s most incredible villas,https://web.archive.org/web/20250118235847/https://www.thetimes.com/
20250118,This untapped Scottish coastline is even more extraordinary in winter,https://web.archive.org/web/20250118235847/https://www.thetimes.com/
20250118,Why this seaside Croatian city is perfect for summer,https://web.archive.org/web/20250118235847/https://www.thetimes.com/
20250118,Bingo to bowling: seven of the UK’s top spots for grown-up games nights,https://web.archive.org/web/20250118235847/https://www.thetimes.com/
20250118,Register,https://web.archive.org/web/20250118235847/https://www.thetimes.com/
20250118,"Denis Law, scorer of ‘miracle goals’ for Manchester United",https://web.archive.org/web/20250118235847/https://www.thetimes.com/
20250118,"Dame Joan Plowright, stalwart of stage and screen",https://web.archive.org/web/20250118235847/https://www.thetimes.com/
20250118,"David Lynch, acclaimed director of Twin Peaks",https://web.archive.org/web/20250118235847/https://www.thetimes.com/
20250118,"Anita Bryant, singer notorious for anti-gay campaigning",https://web.archive.org/web/20250118235847/https://www.thetimes.com/
20250118,Credo: Van Gogh’s experience can help us find our vocation,https://web.archive.org/web/20250118235847/https://www.thetimes.com/
20250118,Washington will be bitterly cold for Trump’s inauguration due to polar vortex,https://web.archive.org/web/20250118235847/https://www.thetimes.com/
20250118,From the archive: Hoodlums on the train to the races,https://web.archive.org/web/20250118235847/https://www.thetimes.com/
20250118,"Births, marriages and deaths",https://web.archive.org/web/20250118235847/https://www.thetimes.com/
20250118,Court Circular,https://web.archive.org/web/20250118235847/https://www.thetimes.com/
