fecha,titular,url_archivo
20250126,Bill will leave children ‘spending longer in failing schools’,https://web.archive.org/web/20250127000210/https://www.thetimes.com/
20250126,Southport killer’s father ‘didn’t let family friend meet son’,https://web.archive.org/web/20250127000210/https://www.thetimes.com/
20250126,Surrealist Schiaparelli to kick off Haute Couture Week,https://web.archive.org/web/20250127000210/https://www.thetimes.com/
20250126,Life & Style,https://web.archive.org/web/20250127000210/https://www.thetimes.com/
20250126,Holly Willoughby: ‘It’s been tough. There’s no way of sugar-coating it’,https://web.archive.org/web/20250127000210/https://www.thetimes.com/
20250126,Jamie Oliver’s five easy air fryer recipes,https://web.archive.org/web/20250127000210/https://www.thetimes.com/
20250126,The real story behind Brian and Maggie — by Matthew Parris (who was there),https://web.archive.org/web/20250127000210/https://www.thetimes.com/
20250126,The Richard Branson diet — how he stays super-fit at 74,https://web.archive.org/web/20250127000210/https://www.thetimes.com/
20250126,Superstar pianist to perform ‘unplayable’ 22hr piece in world first,https://web.archive.org/web/20250127000210/https://www.thetimes.com/
20250126,Virtual reality lets audiences watch from inside the orchestra,https://web.archive.org/web/20250127000210/https://www.thetimes.com/
20250126,Teenage driver in fatal crash was ‘great lad with a heart of gold’,https://web.archive.org/web/20250127000210/https://www.thetimes.com/
20250126,Improvements to accident blackspot delayed by rare snails,https://web.archive.org/web/20250127000210/https://www.thetimes.com/
20250126,Seized bitcoin worth £5bn could fill black hole in public finances,https://web.archive.org/web/20250127000210/https://www.thetimes.com/
20250126,‘Anti-car’ mayor brags of chauffeur-driven limousine on TikTok,https://web.archive.org/web/20250127000210/https://www.thetimes.com/
20250126,Almost half of young people no longer drink alcohol,https://web.archive.org/web/20250127000210/https://www.thetimes.com/
20250126,"Hire criminals to solve prisons crisis, Iceland boss insists",https://web.archive.org/web/20250127000210/https://www.thetimes.com/
20250126,Teenagers get away with knife crime amid stop and search fears,https://web.archive.org/web/20250127000210/https://www.thetimes.com/
20250126,MPs back call for allergy tsar to help prevent further deaths,https://web.archive.org/web/20250127000210/https://www.thetimes.com/
20250126,Group behind Keir Starmer’s rise to power ‘losing staff and donors’,https://web.archive.org/web/20250127000210/https://www.thetimes.com/
20250126,Holocaust survivor goes to Auschwitz to keep the memory alive,https://web.archive.org/web/20250127000210/https://www.thetimes.com/
20250126,CIA believes Chinese lab leak the more likely source of Covid,https://web.archive.org/web/20250127000210/https://www.thetimes.com/
20250126,"We’re a loving family, so why is it so hard to adopt a cat?",https://web.archive.org/web/20250127000210/https://www.thetimes.com/
20250126,"‘Right to die’ must not become a duty, says former home secretary",https://web.archive.org/web/20250127000210/https://www.thetimes.com/
20250126,Akshata Murty: ‘Rishi wore clothes from Oxfam. I fell in love on the spot’,https://web.archive.org/web/20250127000210/https://www.thetimes.com/
20250126,‘Molar Explorer’ thanks inspirational teacher as she reaches pole,https://web.archive.org/web/20250127000210/https://www.thetimes.com/
20250126,Engaged and living in paradise — until they drank toxic limoncello,https://web.archive.org/web/20250127000210/https://www.thetimes.com/
20250126,Sikh group urges home secretary to widen grooming gangs inquiry,https://web.archive.org/web/20250127000210/https://www.thetimes.com/
20250126,Most GPs say everyday stress is mislabelled as mental illness,https://web.archive.org/web/20250127000210/https://www.thetimes.com/
20250126,The Tax List 2025: Britain’s 100 biggest taxpayers revealed,https://web.archive.org/web/20250127000210/https://www.thetimes.com/
20250126,World,https://web.archive.org/web/20250127000210/https://www.thetimes.com/
20250126,Trump orders tariffs after Colombia denies deportation flights,https://web.archive.org/web/20250127000210/https://www.thetimes.com/
20250126,Rwanda-backed rebels take Congo city in ‘declaration of war’,https://web.archive.org/web/20250127000210/https://www.thetimes.com/
20250126,Lebanese army chief ‘leaked military secrets to Hezbollah’,https://web.archive.org/web/20250127000210/https://www.thetimes.com/
20250126,"Give us the Mona Lisa if the Louvre is so bad, says Milan",https://web.archive.org/web/20250127000210/https://www.thetimes.com/
20250126,Trump wants to ‘clean out’ Gaza Strip and relocate Palestinians,https://web.archive.org/web/20250127000210/https://www.thetimes.com/
20250126,How Trump’s plan puts Palestinian allies in an impossible position,https://web.archive.org/web/20250127000210/https://www.thetimes.com/
20250126,German election favourite ‘risks it all’ with asylum plan,https://web.archive.org/web/20250127000210/https://www.thetimes.com/
20250126,Orban threatens to veto EU sanctions if he can’t get Russian gas,https://web.archive.org/web/20250127000210/https://www.thetimes.com/
20250126,"French AI ‘Lucie’ looks très chic, but keeps getting answers wrong",https://web.archive.org/web/20250127000210/https://www.thetimes.com/
20250126,CIA believes Chinese lab leak the more likely source of Covid,https://web.archive.org/web/20250127000210/https://www.thetimes.com/
20250126,Detroit hopes Trump’s tariffs will jump-start its car factories,https://web.archive.org/web/20250127000210/https://www.thetimes.com/
20250126,Vessel seized on suspicion of cutting Baltic internet cable,https://web.archive.org/web/20250127000210/https://www.thetimes.com/
20250126,Roquefort sales in decline as young people turn their noses up,https://web.archive.org/web/20250127000210/https://www.thetimes.com/
20250126,How undersea living pioneer spent record 120 days in ‘dreamland’,https://web.archive.org/web/20250127000210/https://www.thetimes.com/
20250126,Oldest British church in Spain appeals to the motherland for aid,https://web.archive.org/web/20250127000210/https://www.thetimes.com/
20250126,Comment,https://web.archive.org/web/20250127000210/https://www.thetimes.com/
20250126,We can finally put the rich in their place — so they’ve moved away,https://web.archive.org/web/20250127000210/https://www.thetimes.com/
20250126,Voting for a new leader is no longer a rational choice but a magical ritual,https://web.archive.org/web/20250127000210/https://www.thetimes.com/
20250126,"Police, social services, courts, Prevent — they all failed Southport",https://web.archive.org/web/20250127000210/https://www.thetimes.com/
20250126,Aren’t real conservatives on law and order’s side?,https://web.archive.org/web/20250127000210/https://www.thetimes.com/
20250126,"In our idiotic age, footballers and pigeons will rule the roost",https://web.archive.org/web/20250127000210/https://www.thetimes.com/
20250126,Afraid of going bald? Better to grin and bare it,https://web.archive.org/web/20250127000210/https://www.thetimes.com/
20250126,"The state is hooked on secrecy, but worse is what it doesn’t know",https://web.archive.org/web/20250127000210/https://www.thetimes.com/
20250126,Identity politics is going the way of Smash Hits,https://web.archive.org/web/20250127000210/https://www.thetimes.com/
20250126,Do we really spend less when the weather is bad?,https://web.archive.org/web/20250127000210/https://www.thetimes.com/
20250126,"Suddenly, being PM feels a little underpowered*",https://web.archive.org/web/20250127000210/https://www.thetimes.com/
20250126,Children are being poisoned by tech. Join Mumsnet and just say no,https://web.archive.org/web/20250127000210/https://www.thetimes.com/
20250126,NHS treatment versus the French system,https://web.archive.org/web/20250127000210/https://www.thetimes.com/
20250126,Music hall’s poisoned poignard and the fate of farmers abroad,https://web.archive.org/web/20250127000210/https://www.thetimes.com/
20250126,Newman’s week,https://web.archive.org/web/20250127000210/https://www.thetimes.com/
20250126,Growth will help us hold on to our brightest and best,https://web.archive.org/web/20250127000210/https://www.thetimes.com/
20250126,Why can’t the public be trusted with the truth?,https://web.archive.org/web/20250127000210/https://www.thetimes.com/
20250126,Sponsored,https://web.archive.org/web/20250127000210/https://www.thetimes.com/
20250126,Business,https://web.archive.org/web/20250127000210/https://www.thetimes.com/
20250126,New CMA boss pledges to take a pro-growth approach,https://web.archive.org/web/20250127000210/https://www.thetimes.com/
20250126,‘Dirty tricks’ revisited as Virgin Group hits out at Eurostar,https://web.archive.org/web/20250127000210/https://www.thetimes.com/
20250126,WH Smith pulls the plug on 230 years of high street history,https://web.archive.org/web/20250127000210/https://www.thetimes.com/
20250126,"Why time, not money, may stall Heathrow’s third runway",https://web.archive.org/web/20250127000210/https://www.thetimes.com/
20250126,Donald Trump’s crypto boost risks leaving the UK behind,https://web.archive.org/web/20250127000210/https://www.thetimes.com/
20250126,Diageo denies it is looking to sell off Guinness,https://web.archive.org/web/20250127000210/https://www.thetimes.com/
20250126,Why Labour might look back in regret at its war on the watchdogs,https://web.archive.org/web/20250127000210/https://www.thetimes.com/
20250126,How Trump’s economic policies could affect UK interest rates,https://web.archive.org/web/20250127000210/https://www.thetimes.com/
20250126,Empty shelves and £1 meal deals: has Amazon Fresh gone stale?,https://web.archive.org/web/20250127000210/https://www.thetimes.com/
20250126,"Wages are rising, so why isn’t consumer spending keeping up?",https://web.archive.org/web/20250127000210/https://www.thetimes.com/
20250126,American hedge fund pits itself against Saba in fight over UK trusts,https://web.archive.org/web/20250127000210/https://www.thetimes.com/
20250126,US investors drive record number of UK care home deals,https://web.archive.org/web/20250127000210/https://www.thetimes.com/
20250126,Simples! How Compare the Market left its rivals for dust,https://web.archive.org/web/20250127000210/https://www.thetimes.com/
20250126,Donald Trump risks tax war with global minimum tax pullout,https://web.archive.org/web/20250127000210/https://www.thetimes.com/
20250126,No minutes from ‘robust’ meetings to create Great British Railways,https://web.archive.org/web/20250127000210/https://www.thetimes.com/
20250126,National insurance rise is a strange way to pursue growth,https://web.archive.org/web/20250127000210/https://www.thetimes.com/
20250126,More interest rate cuts loom as the job market softens,https://web.archive.org/web/20250127000210/https://www.thetimes.com/
20250126,Chinese buy Italy’s famous moka coffee pot maker Bialetti,https://web.archive.org/web/20250127000210/https://www.thetimes.com/
20250126,Elon Musk is putting Britons off buying Teslas,https://web.archive.org/web/20250127000210/https://www.thetimes.com/
20250126,Britain can compete with the world. But our plans need more urgency,https://web.archive.org/web/20250127000210/https://www.thetimes.com/
20250126,Elton John and Paul McCartney in harmony over the dangers of AI,https://web.archive.org/web/20250127000210/https://www.thetimes.com/
20250126,Labour must stop pleading for cash and play to our strengths,https://web.archive.org/web/20250127000210/https://www.thetimes.com/
20250126,"Airlander, the world’s biggest aircraft, may finally get off ground",https://web.archive.org/web/20250127000210/https://www.thetimes.com/
20250126,The Times Tech Podcast,https://web.archive.org/web/20250127000210/https://www.thetimes.com/
20250126,Give the beauty industry respect — it brings in £30bn for Britain,https://web.archive.org/web/20250127000210/https://www.thetimes.com/
20250126,Unsung heroes: the UK’s biggest taxpayers that go unnoticed,https://web.archive.org/web/20250127000210/https://www.thetimes.com/
20250126,Trump’s policies clash. But the numbers may just add up,https://web.archive.org/web/20250127000210/https://www.thetimes.com/
20250126,Dolphin braces for high-wire ride as it buys Zip World for £100m,https://web.archive.org/web/20250127000210/https://www.thetimes.com/
20250126,Nine is a magic number if you want your firm to be the best it can,https://web.archive.org/web/20250127000210/https://www.thetimes.com/
20250126,Money,https://web.archive.org/web/20250127000210/https://www.thetimes.com/
20250126,Are you becoming trapped by your technology?,https://web.archive.org/web/20250127000210/https://www.thetimes.com/
20250126,"Inheritance tax, pensions and why we should all be worried",https://web.archive.org/web/20250127000210/https://www.thetimes.com/
20250126,How to invest like a Pelosi,https://web.archive.org/web/20250127000210/https://www.thetimes.com/
20250126,Pension payback: how to claim if you’re a higher-rate taxpayer,https://web.archive.org/web/20250127000210/https://www.thetimes.com/
20250126,Five things to avoid getting wrong on your tax return,https://web.archive.org/web/20250127000210/https://www.thetimes.com/
20250126,Sam McKnight: For Vogue shoots I would get about £20 a day,https://web.archive.org/web/20250127000210/https://www.thetimes.com/
20250126,The damage done by that ear-piercing Stones gig is now music to my portfolio,https://web.archive.org/web/20250127000210/https://www.thetimes.com/
20250126,I am £50k in student debt — but that’s the least of my worries,https://web.archive.org/web/20250127000210/https://www.thetimes.com/
20250126,Do I need to update my power of attorney?,https://web.archive.org/web/20250127000210/https://www.thetimes.com/
20250126,My £34k car had a run-in with a forklift — two years on and Axa still won’t pay,https://web.archive.org/web/20250127000210/https://www.thetimes.com/
20250126,The Sunday Times Magazine,https://web.archive.org/web/20250127000210/https://www.thetimes.com/
20250126,How a McDonald’s and a bread factory ended up employing slaves,https://web.archive.org/web/20250127000210/https://www.thetimes.com/
20250126,Akshata Murty: ‘Rishi wore clothes from Oxfam. I fell in love on the spot’,https://web.archive.org/web/20250127000210/https://www.thetimes.com/
20250126,Why did Trump pardon Silk Road mastermind Ross Ulbricht?,https://web.archive.org/web/20250127000210/https://www.thetimes.com/
20250126,Philippa Perry: ‘People think their feelings are so real now’,https://web.archive.org/web/20250127000210/https://www.thetimes.com/
20250126,Flora Gill: my son’s birth triggered fresh grief for my dead father,https://web.archive.org/web/20250127000210/https://www.thetimes.com/
20250126,Is gin less popular? Why the UK’s thirst is drying up,https://web.archive.org/web/20250127000210/https://www.thetimes.com/
20250126,Jamie Oliver’s five easy air fryer recipes,https://web.archive.org/web/20250127000210/https://www.thetimes.com/
20250126,The Richard Branson diet — how he stays super-fit at 74,https://web.archive.org/web/20250127000210/https://www.thetimes.com/
20250126,"Like a Gen Zer with a lightbulb, I hide my talents",https://web.archive.org/web/20250127000210/https://www.thetimes.com/
20250126,Jools Holland: ‘Ed Sheeran said I had it all wrong’,https://web.archive.org/web/20250127000210/https://www.thetimes.com/
20250126,Stow restaurant review: ‘I’ll think of these potatoes on my deathbed’,https://web.archive.org/web/20250127000210/https://www.thetimes.com/
20250126,Am I fit for my age? Exercises for your 30s to your 70s,https://web.archive.org/web/20250127000210/https://www.thetimes.com/
20250126,Six of the best bottles to toast the end of Dry January,https://web.archive.org/web/20250127000210/https://www.thetimes.com/
20250126,"What’s the best frozen pain au chocolat? Six brands, tried and tested",https://web.archive.org/web/20250127000210/https://www.thetimes.com/
20250126,"The Clarkson review: McLaren Artura Spider — God, they’re good",https://web.archive.org/web/20250127000210/https://www.thetimes.com/
20250126,I live in the Lake District and want a change from my Range Rover Evoque — what should I go for?,https://web.archive.org/web/20250127000210/https://www.thetimes.com/
20250126,In case you missed it,https://web.archive.org/web/20250127000210/https://www.thetimes.com/
20250126,"The fantasy life of Daniel Khalife, the Wandsworth prison fugitive",https://web.archive.org/web/20250127000210/https://www.thetimes.com/
20250126,Michael Heseltine: ‘Nigel Farage? Destroy him’,https://web.archive.org/web/20250127000210/https://www.thetimes.com/
20250126,Is France’s healthcare system the cure for the NHS?,https://web.archive.org/web/20250127000210/https://www.thetimes.com/
20250126,"Michaela Strachan: ‘I look back on stuff I did and think, how did I last?’",https://web.archive.org/web/20250127000210/https://www.thetimes.com/
20250126,Culture,https://web.archive.org/web/20250127000210/https://www.thetimes.com/
20250126,"No star, no script, no plan: where’s it gone wrong for James Bond?",https://web.archive.org/web/20250127000210/https://www.thetimes.com/
20250126,The real story behind Brian and Maggie — by Matthew Parris (who was there),https://web.archive.org/web/20250127000210/https://www.thetimes.com/
20250126,Zadie Smith on White Teeth: ‘I’ve never reread it. I never will’,https://web.archive.org/web/20250127000210/https://www.thetimes.com/
20250126,Help! I’m a TV crime drama-phobic,https://web.archive.org/web/20250127000210/https://www.thetimes.com/
20250126,‘The moment they don’t want music we go to the gas chambers’,https://web.archive.org/web/20250127000210/https://www.thetimes.com/
20250126,"KGB spies, stolen art and flying underpants — when Gilbert & George went to the USSR",https://web.archive.org/web/20250127000210/https://www.thetimes.com/
20250126,5 of the best … screen Thatchers,https://web.archive.org/web/20250127000210/https://www.thetimes.com/
20250126,The Brutalist is an Oscar favourite — but it’s a brutally boring masterpiece,https://web.archive.org/web/20250127000210/https://www.thetimes.com/
20250126,25 years of White Teeth — how Zadie Smith’s debut became an instant classic,https://web.archive.org/web/20250127000210/https://www.thetimes.com/
20250126,It looked like my Uncle Eric failed in life — but he was the ‘secret Lowry’,https://web.archive.org/web/20250127000210/https://www.thetimes.com/
20250126,Why is Ricky Gervais’s 20-year-old podcast top of the charts again?,https://web.archive.org/web/20250127000210/https://www.thetimes.com/
20250126,Romola Garai: ‘A lot of people in the industry find women over 40 repellent’,https://web.archive.org/web/20250127000210/https://www.thetimes.com/
20250126,All 25 James Bond films ranked by expert insiders,https://web.archive.org/web/20250127000210/https://www.thetimes.com/
20250126,Could sleeping like a caveman cure your insomnia?,https://web.archive.org/web/20250127000210/https://www.thetimes.com/
20250126,One of the hottest names in art has the talent of an old master,https://web.archive.org/web/20250127000210/https://www.thetimes.com/
20250126,The Sunday Times Bestsellers List — the UK’s definitive book chart,https://web.archive.org/web/20250127000210/https://www.thetimes.com/
20250126,Joseph O’Connor returns with a second wartime Vatican thriller,https://web.archive.org/web/20250127000210/https://www.thetimes.com/
20250126,A triumphant spoof of Andrew Lloyd Webber? It’s better than Cats,https://web.archive.org/web/20250127000210/https://www.thetimes.com/
20250126,The trouble with escaping an abusive husband,https://web.archive.org/web/20250127000210/https://www.thetimes.com/
20250126,Italy’s pop star philosopher — with a sadomasochistic streak,https://web.archive.org/web/20250127000210/https://www.thetimes.com/
20250126,Stories to teach your children about love,https://web.archive.org/web/20250127000210/https://www.thetimes.com/
20250126,What to watch: your TV and streaming guide,https://web.archive.org/web/20250127000210/https://www.thetimes.com/
20250126,The Castaways — like The Blue Lagoon meets a Harlan Coben thriller,https://web.archive.org/web/20250127000210/https://www.thetimes.com/
20250126,What to watch on TV this week — The Apprentice and more,https://web.archive.org/web/20250127000210/https://www.thetimes.com/
20250126,"Lies, spies and secrets: 20 conspiracy thrillers to watch now",https://web.archive.org/web/20250127000210/https://www.thetimes.com/
20250126,The best films to watch at home this week — from Knives Out to Mr Turner,https://web.archive.org/web/20250127000210/https://www.thetimes.com/
20250126,The best podcasts and radio shows of the week,https://web.archive.org/web/20250127000210/https://www.thetimes.com/
20250126,The best shows on Netflix,https://web.archive.org/web/20250127000210/https://www.thetimes.com/
20250126,The best shows on ITVX,https://web.archive.org/web/20250127000210/https://www.thetimes.com/
20250126,The best shows on BBC iPlayer,https://web.archive.org/web/20250127000210/https://www.thetimes.com/
20250126,The best shows on Disney+,https://web.archive.org/web/20250127000210/https://www.thetimes.com/
20250126,The best shows on Prime Video,https://web.archive.org/web/20250127000210/https://www.thetimes.com/
20250126,The best shows on Sky and Now,https://web.archive.org/web/20250127000210/https://www.thetimes.com/
20250126,TV listings,https://web.archive.org/web/20250127000210/https://www.thetimes.com/
20250126,Style,https://web.archive.org/web/20250127000210/https://www.thetimes.com/
20250126,Holly Willoughby: ‘It’s been tough. There’s no way of sugar-coating it’,https://web.archive.org/web/20250127000210/https://www.thetimes.com/
20250126,Bridget Jones’s style is in fashion — and I couldn’t be happier,https://web.archive.org/web/20250127000210/https://www.thetimes.com/
20250126,"The rise of the £1,000 manicure",https://web.archive.org/web/20250127000210/https://www.thetimes.com/
20250126,All hail the ‘soccer mom’! How to nail the new off-duty uniform,https://web.archive.org/web/20250127000210/https://www.thetimes.com/
20250126,Why Gen A are swapping fast fashion for make do and mend,https://web.archive.org/web/20250127000210/https://www.thetimes.com/
20250126,"The new accessories brag? Hotel merch (yes, really)",https://web.archive.org/web/20250127000210/https://www.thetimes.com/
20250126,Sophie Ellis-Bextor: I’m not worried about looking cool,https://web.archive.org/web/20250127000210/https://www.thetimes.com/
20250126,Meet the women turning their fertility journey into viral TikToks,https://web.archive.org/web/20250127000210/https://www.thetimes.com/
20250126,Inside the east London house that looks like a New York brownstone,https://web.archive.org/web/20250127000210/https://www.thetimes.com/
20250126,The return of the miniskirt suit — plus 5 more trends to know now,https://web.archive.org/web/20250127000210/https://www.thetimes.com/
20250126,"Coffee, but make it chic — from the must-have machine to cool cups",https://web.archive.org/web/20250127000210/https://www.thetimes.com/
20250126,From dull skin to a hangover — there’s a patch for everything,https://web.archive.org/web/20250127000210/https://www.thetimes.com/
20250126,This supremely flattering matte lipstick is a steal at £10,https://web.archive.org/web/20250127000210/https://www.thetimes.com/
20250126,"10 things to buy now: beauty, accessories and more",https://web.archive.org/web/20250127000210/https://www.thetimes.com/
20250126,Sport,https://web.archive.org/web/20250127000210/https://www.thetimes.com/
20250126,Postecoglou nightmare continues as Spurs crumble in dismal defeat,https://web.archive.org/web/20250127000210/https://www.thetimes.com/
20250126,Ange: This is our lowest ebb but my players still believe in me,https://web.archive.org/web/20250127000210/https://www.thetimes.com/
20250126,"Amorim on Rashford: I’d rather pick coach, 63, over player who doesn’t give all",https://web.archive.org/web/20250127000210/https://www.thetimes.com/
20250126,Martínez seals precious win for United team still playing like underdogs,https://web.archive.org/web/20250127000210/https://www.thetimes.com/
20250126,Police investigate death threats towards Oliver after Arsenal red card,https://web.archive.org/web/20250127000210/https://www.thetimes.com/
20250126,Solskjaer finds new Istanbul job just as daunting as his United one,https://web.archive.org/web/20250127000210/https://www.thetimes.com/
20250126,Pep: Khusanov debut was an error — we need Stones for Wednesday’s ‘final’,https://web.archive.org/web/20250127000210/https://www.thetimes.com/
20250126,Russell signs off in world-class style as Sale left with ‘sour grapes’,https://web.archive.org/web/20250127000210/https://www.thetimes.com/
20250126,Smith: My FaceTime calls home are keeping me sane,https://web.archive.org/web/20250127000210/https://www.thetimes.com/
20250126,Mings injury adds further pain to Emery’s Champions League hangover,https://web.archive.org/web/20250127000210/https://www.thetimes.com/
20250126,VAR in spotlight again as Brentford profit from penalty controversy,https://web.archive.org/web/20250127000210/https://www.thetimes.com/
20250126,Access all areas: my three days inside England’s training camp,https://web.archive.org/web/20250127000210/https://www.thetimes.com/
20250126,Sinner: If I was guilty of doping I would not be playing like this,https://web.archive.org/web/20250127000210/https://www.thetimes.com/
