fecha,titular,url_archivo
20250101,Accessibility Links,https://web.archive.org/web/20250101234554/https://www.thetimes.com/
20250101,The Times & The Sunday Times Homepage,https://web.archive.org/web/20250101234554/https://www.thetimes.com/
20250101,News,https://web.archive.org/web/20250101234554/https://www.thetimes.com/
20250101,‘Terrorist’ truck attacker kills 15 in New Orleans,https://web.archive.org/web/20250101234554/https://www.thetimes.com/
20250101,Happy crowds thronged New Orleans … then the truck struck,https://web.archive.org/web/20250101234554/https://www.thetimes.com/
20250101,Who is the New Orleans attacker? Military veteran ‘radicalised in past year’,https://web.archive.org/web/20250101234554/https://www.thetimes.com/
20250101,Jane Austen fans will flock to UK for 250th anniversary,https://web.archive.org/web/20250101234554/https://www.thetimes.com/
20250101,Vice-chancellors at ‘struggling’ universities spent £1m on trips abroad,https://web.archive.org/web/20250101234554/https://www.thetimes.com/
20250101,Alastair Campbell’s son faces questions over failed betting syndicate,https://web.archive.org/web/20250101234554/https://www.thetimes.com/
20250101,"Aspiring nurse, 18, and father of two among New Orleans victims",https://web.archive.org/web/20250101234554/https://www.thetimes.com/
20250101,What the New Orleans terrorist attack means for Trump,https://web.archive.org/web/20250101234554/https://www.thetimes.com/
20250101,Britain braces for price hikes as Ukraine stops piping Russian gas,https://web.archive.org/web/20250101234554/https://www.thetimes.com/
20250101,Will end of Russian gas supply raise UK energy prices?,https://web.archive.org/web/20250101234554/https://www.thetimes.com/
20250101,‘Inside job ruled out’ in jewellery heist at socialite’s mansion,https://web.archive.org/web/20250101234554/https://www.thetimes.com/
20250101,Socialite dubbed ‘bride of Wildenstein’ dies aged 84,https://web.archive.org/web/20250101234554/https://www.thetimes.com/
20250101,Editor’s picks,https://web.archive.org/web/20250101234554/https://www.thetimes.com/
20250101,Golden Globes: who will win and who should win?,https://web.archive.org/web/20250101234554/https://www.thetimes.com/
20250101,"What next for Coleen — and Wayne Rooney, football’s Odysseus?",https://web.archive.org/web/20250101234554/https://www.thetimes.com/
20250101,My great big clear-out for the new year,https://web.archive.org/web/20250101234554/https://www.thetimes.com/
20250101,Norris: I never believed I could be the best — until now,https://web.archive.org/web/20250101234554/https://www.thetimes.com/
20250101,Politics,https://web.archive.org/web/20250101234554/https://www.thetimes.com/
20250101,Starmer booed for jumping three-hour toboggan queue on holiday,https://web.archive.org/web/20250101234554/https://www.thetimes.com/
20250101,Treasury attacked over ‘tax break’ claim in private school VAT ads,https://web.archive.org/web/20250101234554/https://www.thetimes.com/
20250101,Channel deaths soar as small-boat arrivals rise by a quarter,https://web.archive.org/web/20250101234554/https://www.thetimes.com/
20250101,‘I’m terrified this winter’: the pensioners who can’t afford heating,https://web.archive.org/web/20250101234554/https://www.thetimes.com/
20250101,Government misses deadline to restrict destructive fishing practices,https://web.archive.org/web/20250101234554/https://www.thetimes.com/
20250101,Coroner warns hospital over woman’s death after weight loss surgery,https://web.archive.org/web/20250101234554/https://www.thetimes.com/
20250101,Fans bored by Weaver still happy to pay for the Bard,https://web.archive.org/web/20250101234554/https://www.thetimes.com/
20250101,Restaurant owner uses tracker to catch cheese thieves,https://web.archive.org/web/20250101234554/https://www.thetimes.com/
20250101,Surf’s up: Harry teaches son Archie to ride the waves,https://web.archive.org/web/20250101234554/https://www.thetimes.com/
20250101,Trans police can hold multiple warrant cards for different genders,https://web.archive.org/web/20250101234554/https://www.thetimes.com/
20250101,Missing woman found 52 years on after police share this photo,https://web.archive.org/web/20250101234554/https://www.thetimes.com/
20250101,Prince Alexander of Yugoslavia was a ‘petrol pilferer’ while in the RAF,https://web.archive.org/web/20250101234554/https://www.thetimes.com/
20250101,Pope criticises assisted dying in new year message,https://web.archive.org/web/20250101234554/https://www.thetimes.com/
20250101,"Did Scandinavian gladiators cross swords in Britain 1,800 years ago?",https://web.archive.org/web/20250101234554/https://www.thetimes.com/
20250101,Thousands duped by hoax firework display ‘created by AI’,https://web.archive.org/web/20250101234554/https://www.thetimes.com/
20250101,How board games can help health and care workers cope with a crisis,https://web.archive.org/web/20250101234554/https://www.thetimes.com/
20250101,My day sweating like a pro cyclist and what it taught me about salt,https://web.archive.org/web/20250101234554/https://www.thetimes.com/
20250101,Burst of light brighter than entire galaxy came from neutron star,https://web.archive.org/web/20250101234554/https://www.thetimes.com/
20250101,The hope for Ukrainian children that sprung from horror of Bosnian War,https://web.archive.org/web/20250101234554/https://www.thetimes.com/
20250101,‘Molar Explorer’ sees in new year alone in Antarctic,https://web.archive.org/web/20250101234554/https://www.thetimes.com/
20250101,Met Office warns of heavy snow as cold snap approaches,https://web.archive.org/web/20250101234554/https://www.thetimes.com/
20250101,News in pictures,https://web.archive.org/web/20250101234554/https://www.thetimes.com/
20250101,World,https://web.archive.org/web/20250101234554/https://www.thetimes.com/
20250101,Why ‘open-hearted’ Sweden brought in a wholesale crackdown on asylum,https://web.archive.org/web/20250101234554/https://www.thetimes.com/
20250101,Ukrainians drop their New Year champagne as drone sirens ring out,https://web.archive.org/web/20250101234554/https://www.thetimes.com/
20250101,Europe’s fireworks frenzy turns New Year’s Eve into deadly mayhem,https://web.archive.org/web/20250101234554/https://www.thetimes.com/
20250101,Blake Lively director sues New York Times for sex harassment claims,https://web.archive.org/web/20250101234554/https://www.thetimes.com/
20250101,Ivory Coast is latest to remove French troops as colonial power wanes,https://web.archive.org/web/20250101234554/https://www.thetimes.com/
20250101,War of the chefs over ‘enchanting’ Riviera restaurant,https://web.archive.org/web/20250101234554/https://www.thetimes.com/
20250101,Will genetically modified rice end hay fever misery for millions?,https://web.archive.org/web/20250101234554/https://www.thetimes.com/
20250101,One person killed as Tesla Cybertruck ‘explodes’ in Las Vegas,https://web.archive.org/web/20250101234554/https://www.thetimes.com/
20250101,"Hermès tight-lipped on Wirkin bag, Walmart’s dupe of the Birkin",https://web.archive.org/web/20250101234554/https://www.thetimes.com/
20250101,I am Maximus: Musk turns into a frog for followers on X,https://web.archive.org/web/20250101234554/https://www.thetimes.com/
20250101,Kim and daughter check out North Korean resort with military past,https://web.archive.org/web/20250101234554/https://www.thetimes.com/
20250101,Gisèle Pelicot named as France’s most influential figure of year,https://web.archive.org/web/20250101234554/https://www.thetimes.com/
20250101,Serbian president says he ‘won’t flee like Assad’ as protests grow,https://web.archive.org/web/20250101234554/https://www.thetimes.com/
20250101,Sydney snake catcher springs into action as summer heats up,https://web.archive.org/web/20250101234554/https://www.thetimes.com/
20250101,The Marseilles mafia so big it’s now a brand,https://web.archive.org/web/20250101234554/https://www.thetimes.com/
20250101,Israel prepares to rain fire and fury on the Houthis,https://web.archive.org/web/20250101234554/https://www.thetimes.com/
20250101,FBI seizes ‘largest cache of homemade explosives ever found’,https://web.archive.org/web/20250101234554/https://www.thetimes.com/
20250101,Flight data recorder from Jeju Air crash to be sent to US for analysis,https://web.archive.org/web/20250101234554/https://www.thetimes.com/
20250101,Comment,https://web.archive.org/web/20250101234554/https://www.thetimes.com/
20250101,Tech firm’s fate shows Trump is right on China,https://web.archive.org/web/20250101234554/https://www.thetimes.com/
20250101,Wanted: a new generation of TV mavericks,https://web.archive.org/web/20250101234554/https://www.thetimes.com/
20250101,Silence is deafening on Covid school closures,https://web.archive.org/web/20250101234554/https://www.thetimes.com/
20250101,Cricketers should stand up to Taliban’s gender apartheid,https://web.archive.org/web/20250101234554/https://www.thetimes.com/
20250101,Tories’ guidance on LTNs must become Labour’s roadmap,https://web.archive.org/web/20250101234554/https://www.thetimes.com/
20250101,Black marks on Labour’s education policy,https://web.archive.org/web/20250101234554/https://www.thetimes.com/
20250101,Daily Universal Register,https://web.archive.org/web/20250101234554/https://www.thetimes.com/
20250101,Sponsored,https://web.archive.org/web/20250101234554/https://www.thetimes.com/
20250101,Business,https://web.archive.org/web/20250101234554/https://www.thetimes.com/
20250101,Bank ‘to cut interest rates at least four times in 2025’,https://web.archive.org/web/20250101234554/https://www.thetimes.com/
20250101,Enough growth to please chancellor — but a reckoning looms on tax,https://web.archive.org/web/20250101234554/https://www.thetimes.com/
20250101,Blackstone snaps up £1bn of warehouses in a year,https://web.archive.org/web/20250101234554/https://www.thetimes.com/
20250101,The leaders and the laggards in a turbulent 2024,https://web.archive.org/web/20250101234554/https://www.thetimes.com/
20250101,Bute Energy promises 200 onshore wind turbines by 2030,https://web.archive.org/web/20250101234554/https://www.thetimes.com/
20250101,"Tell us if you overclaimed R&D tax credit by accident, says HMRC",https://web.archive.org/web/20250101234554/https://www.thetimes.com/
20250101,Neil Woodford’s tearful interview left big questions unanswered,https://web.archive.org/web/20250101234554/https://www.thetimes.com/
20250101,It’s a new year but UK still has the same old growth problem,https://web.archive.org/web/20250101234554/https://www.thetimes.com/
20250101,"David Lloyd adds desks and spas so members can work, rest and play",https://web.archive.org/web/20250101234554/https://www.thetimes.com/
20250101,FTSE 100 rises four years in a row — but Wall Street charges ahead,https://web.archive.org/web/20250101234554/https://www.thetimes.com/
20250101,Bernard Madoff’s Ponzi victims receive final compensation payment,https://web.archive.org/web/20250101234554/https://www.thetimes.com/
20250101,Bank of England grows cool on the idea of ‘Britcoin’,https://web.archive.org/web/20250101234554/https://www.thetimes.com/
20250101,Chinese economy hits growth target as world braces for tariffs,https://web.archive.org/web/20250101234554/https://www.thetimes.com/
20250101,Heathrow’s New York service clings to spot in top aviation routes,https://web.archive.org/web/20250101234554/https://www.thetimes.com/
20250101,In Case You Missed It,https://web.archive.org/web/20250101234554/https://www.thetimes.com/
20250101,Tempus tips for 2025: five steady shares for a year of change,https://web.archive.org/web/20250101234554/https://www.thetimes.com/
20250101,"Buzzwords of the year, from petty-sacking to coffee-badging",https://web.archive.org/web/20250101234554/https://www.thetimes.com/
20250101,Most wanted shares of 2024: AI boom puts Nvidia top of the tree,https://web.archive.org/web/20250101234554/https://www.thetimes.com/
20250101,"If bosses like the London market so much, why are they leaving it?",https://web.archive.org/web/20250101234554/https://www.thetimes.com/
20250101,The Times Enterprise Network,https://web.archive.org/web/20250101234554/https://www.thetimes.com/
20250101,‘The secret to making AI work is to get people trained and enthused’,https://web.archive.org/web/20250101234554/https://www.thetimes.com/
20250101,Using ChatGPT in our care business gives us more time for people,https://web.archive.org/web/20250101234554/https://www.thetimes.com/
20250101,How AI is helping a home shopping company to grow,https://web.archive.org/web/20250101234554/https://www.thetimes.com/
20250101,‘Losing my son has inspired me to be braver’,https://web.archive.org/web/20250101234554/https://www.thetimes.com/
20250101,How AI helps small newcomers compete with the giants,https://web.archive.org/web/20250101234554/https://www.thetimes.com/
20250101,Sport,https://web.archive.org/web/20250101234554/https://www.thetimes.com/
20250101,Littler reaches semi-finals ‘playing with absolute confidence and freedom’,https://web.archive.org/web/20250101234554/https://www.thetimes.com/
20250101,Real consider second January bid for Alexander-Arnold,https://web.archive.org/web/20250101234554/https://www.thetimes.com/
20250101,Norris: I never believed I could be the best — until now,https://web.archive.org/web/20250101234554/https://www.thetimes.com/
20250101,Arsenal show tough side in statement win that cuts gap to Liverpool,https://web.archive.org/web/20250101234554/https://www.thetimes.com/
20250101,"Nwaneri deserved to start, says Arteta after teenager excels on full debut",https://web.archive.org/web/20250101234554/https://www.thetimes.com/
20250101,Rohit retirement rumours cloud India’s build-up to Sydney finale,https://web.archive.org/web/20250101234554/https://www.thetimes.com/
20250101,"Unlike other sports, darts offers no safety valve – it’s a brutal test",https://web.archive.org/web/20250101234554/https://www.thetimes.com/
20250101,Rise of King Louis and return of Dupont: why 2025 could be vintage French year,https://web.archive.org/web/20250101234554/https://www.thetimes.com/
20250101,Every Premier League club’s season so far in one stat,https://web.archive.org/web/20250101234554/https://www.thetimes.com/
20250101,Has Isak replaced Haaland as Premier League’s best striker?,https://web.archive.org/web/20250101234554/https://www.thetimes.com/
20250101,Watch: Windass scores 67-yard screamer from inside his own half,https://web.archive.org/web/20250101234554/https://www.thetimes.com/
20250101,Sunderland gifted promotion boost after Sheffield United’s comedy of errors,https://web.archive.org/web/20250101234554/https://www.thetimes.com/
20250101,‘Tired’ Leeds denied tenth straight home win by last-gasp Batth strike,https://web.archive.org/web/20250101234554/https://www.thetimes.com/
20250101,Premiership team of the season (so far) and who will bounce back: Saracens or Bristol?,https://web.archive.org/web/20250101234554/https://www.thetimes.com/
20250101,Boulter wins to avoid United Cup showdown with fiancé De Minaur,https://web.archive.org/web/20250101234554/https://www.thetimes.com/
20250101,Fulham fear Marseille will improve on £20m summer bid for Pereira,https://web.archive.org/web/20250101234554/https://www.thetimes.com/
20250101,‘A team of rags and tatters’ — the day United were relegated,https://web.archive.org/web/20250101234554/https://www.thetimes.com/
20250101,The Unseen year – from Euros to Hallam FC: Bradley Ormesher’s top images of 2024,https://web.archive.org/web/20250101234554/https://www.thetimes.com/
20250101,Rob Wright’s Thursday racing tips,https://web.archive.org/web/20250101234554/https://www.thetimes.com/
20250101,Sponsored,https://web.archive.org/web/20250101234554/https://www.thetimes.com/
20250101,Times2,https://web.archive.org/web/20250101234554/https://www.thetimes.com/
20250101,Martin Compston: A new Line of Duty? ‘I would’,https://web.archive.org/web/20250101234554/https://www.thetimes.com/
20250101,"What next for Coleen — and Wayne Rooney, football’s Odysseus?",https://web.archive.org/web/20250101234554/https://www.thetimes.com/
20250101,"The Traitors series 3 — train sacrifices, fake tears and ruthlessness galore",https://web.archive.org/web/20250101234554/https://www.thetimes.com/
20250101,"Canteen restaurant review: ‘It’s like a smaller, cheaper River Cafe’",https://web.archive.org/web/20250101234554/https://www.thetimes.com/
20250101,Are you caught in the ABC sex trap?,https://web.archive.org/web/20250101234554/https://www.thetimes.com/
20250101,How to lose inches with the only strength workout you need,https://web.archive.org/web/20250101234554/https://www.thetimes.com/
20250101,Ten years ago I bought a bitcoin for £250 — now it’s worth £75k,https://web.archive.org/web/20250101234554/https://www.thetimes.com/
20250101,John Cleese called me ‘a half-educated tenement Scot’,https://web.archive.org/web/20250101234554/https://www.thetimes.com/
20250101,My great big clear-out for the new year,https://web.archive.org/web/20250101234554/https://www.thetimes.com/
20250101,Gavin & Stacey: A Fond Farewell was a love-in like few others,https://web.archive.org/web/20250101234554/https://www.thetimes.com/
20250101,SAS Rogue Heroes — Paddy Mayne’s men make the Dirty Dozen look like wimps,https://web.archive.org/web/20250101234554/https://www.thetimes.com/
20250101,Streaming has ruined music and films — this year I’m going retro,https://web.archive.org/web/20250101234554/https://www.thetimes.com/
20250101,Six of the best non-alcoholic drinks for Dry January,https://web.archive.org/web/20250101234554/https://www.thetimes.com/
20250101,The hotlist for 2025 — what the style set are lusting after this year,https://web.archive.org/web/20250101234554/https://www.thetimes.com/
20250101,Teen drinking: the trouble with girls (and what parents can do),https://web.archive.org/web/20250101234554/https://www.thetimes.com/
20250101,Golden Globes: who will win and who should win?,https://web.archive.org/web/20250101234554/https://www.thetimes.com/
20250101,"Finally, Angelina Jolie and Brad Pitt’s divorce saga is over",https://web.archive.org/web/20250101234554/https://www.thetimes.com/
20250101,Nickel Boys is a shatteringly powerful movie that rethinks cinema itself,https://web.archive.org/web/20250101234554/https://www.thetimes.com/
20250101,Missing You — Netflix’s latest Harlan Coben is hard to digest,https://web.archive.org/web/20250101234554/https://www.thetimes.com/
20250101,Brenda Blethyn: ‘I knew it was time to end Vera’,https://web.archive.org/web/20250101234554/https://www.thetimes.com/
20250101,"How to win The Traitors, television’s best game show",https://web.archive.org/web/20250101234554/https://www.thetimes.com/
20250101,Bonnie Tyler: ‘I don’t go around with bodyguards. I’m not Mariah Carey’,https://web.archive.org/web/20250101234554/https://www.thetimes.com/
20250101,What to expect from the housing market in 2025,https://web.archive.org/web/20250101234554/https://www.thetimes.com/
20250101,The Metropolitan Opera’s Aida — tacky show is like a night in a Vegas casino,https://web.archive.org/web/20250101234554/https://www.thetimes.com/
20250101,The 10 best exhibitions to see in 2025: the critic’s choice,https://web.archive.org/web/20250101234554/https://www.thetimes.com/
20250101,Come to Bognor! A beautiful novel about the small pleasures of life,https://web.archive.org/web/20250101234554/https://www.thetimes.com/
20250101,Build-to-rent won’t solve the UK’s housing crisis,https://web.archive.org/web/20250101234554/https://www.thetimes.com/
20250101,Do we need to pay council tax on our family annexe?,https://web.archive.org/web/20250101234554/https://www.thetimes.com/
20250101,The best classical albums of 2025,https://web.archive.org/web/20250101234554/https://www.thetimes.com/
20250101,What to watch: your TV and streaming guide,https://web.archive.org/web/20250101234554/https://www.thetimes.com/
20250101,Your daily guide to the best TV this New Year,https://web.archive.org/web/20250101234554/https://www.thetimes.com/
20250101,The best shows on Netflix,https://web.archive.org/web/20250101234554/https://www.thetimes.com/
20250101,The best films on BBC iPlayer,https://web.archive.org/web/20250101234554/https://www.thetimes.com/
20250101,The best shows on Disney+,https://web.archive.org/web/20250101234554/https://www.thetimes.com/
20250101,The best shows on BBC iPlayer,https://web.archive.org/web/20250101234554/https://www.thetimes.com/
20250101,The best shows on Channel 4 streaming,https://web.archive.org/web/20250101234554/https://www.thetimes.com/
20250101,The best shows on Sky and Now,https://web.archive.org/web/20250101234554/https://www.thetimes.com/
20250101,Your daily guide to the best films to watch at home this Christmas,https://web.archive.org/web/20250101234554/https://www.thetimes.com/
20250101,TV listings,https://web.archive.org/web/20250101234554/https://www.thetimes.com/
20250101,The 40 books to look out for in 2025 — our critics’ picks,https://web.archive.org/web/20250101234554/https://www.thetimes.com/
20250101,Readers’ recipes: share your kitchen secrets,https://web.archive.org/web/20250101234554/https://www.thetimes.com/
20250101,The Times Daily Quiz,https://web.archive.org/web/20250101234554/https://www.thetimes.com/
20250101,Word Watch,https://web.archive.org/web/20250101234554/https://www.thetimes.com/
20250101,In case you missed it,https://web.archive.org/web/20250101234554/https://www.thetimes.com/
20250101,Best places to live in the UK — according to data,https://web.archive.org/web/20250101234554/https://www.thetimes.com/
20250101,I know why so many young women are on long-term sick leave,https://web.archive.org/web/20250101234554/https://www.thetimes.com/
20250101,How to beat insomnia — the secrets of sleeping like a caveman,https://web.archive.org/web/20250101234554/https://www.thetimes.com/
20250101,‘Blake Lively texts me’ — Paul Hollywood on his A-list fans,https://web.archive.org/web/20250101234554/https://www.thetimes.com/
20250101,Luxury,https://web.archive.org/web/20250101234554/https://www.thetimes.com/
20250101,How to mark the new year — Tudor-style,https://web.archive.org/web/20250101234554/https://www.thetimes.com/
20250101,Dear Julia: How do I approach new year’s resolutions in a healthy way?,https://web.archive.org/web/20250101234554/https://www.thetimes.com/
20250101,The vineyards with celebrity power,https://web.archive.org/web/20250101234554/https://www.thetimes.com/
20250101,A very alternative guide to New Year’s resolutions,https://web.archive.org/web/20250101234554/https://www.thetimes.com/
20250101,The big champagne houses that had plenty to celebrate in 2024,https://web.archive.org/web/20250101234554/https://www.thetimes.com/
20250101,Just One Dish: Jeremy Chan,https://web.archive.org/web/20250101234554/https://www.thetimes.com/
20250101,"The Times Luxury cartoon: December 30, 2024",https://web.archive.org/web/20250101234554/https://www.thetimes.com/
20250101,Want Elton John at your party? Here’s who to call,https://web.archive.org/web/20250101234554/https://www.thetimes.com/
20250101,"Tiny car, big impact: microcars have a new lease of life",https://web.archive.org/web/20250101234554/https://www.thetimes.com/
20250101,Travel,https://web.archive.org/web/20250101234554/https://www.thetimes.com/
20250101,The best thing to do in every US state in 2025,https://web.archive.org/web/20250101234554/https://www.thetimes.com/
20250101,Seven of the UK’s cosiest cottages for couples,https://web.archive.org/web/20250101234554/https://www.thetimes.com/
20250101,The fairytale Swiss city that you should visit at least once,https://web.archive.org/web/20250101234554/https://www.thetimes.com/
20250101,88 of the best holiday destinations for 2025: a month-by-month guide,https://web.archive.org/web/20250101234554/https://www.thetimes.com/
20250101,10 of the best places to visit in Albania,https://web.archive.org/web/20250101234554/https://www.thetimes.com/
20250101,Compensation for cancelled and delayed flights: everything you need to know,https://web.archive.org/web/20250101234554/https://www.thetimes.com/
20250101,The TikTok travel trend preventing teens from exploring the world,https://web.archive.org/web/20250101234554/https://www.thetimes.com/
20250101,9 of the best cruise lines for young people,https://web.archive.org/web/20250101234554/https://www.thetimes.com/
20250101,James Middleton: Why we got funny looks when we boarded the plane,https://web.archive.org/web/20250101234554/https://www.thetimes.com/
20250101,"Win a luxury break for two in North Yorkshire worth up to £2,422 at Saltmoore",https://web.archive.org/web/20250101234554/https://www.thetimes.com/
20250101,Register,https://web.archive.org/web/20250101234554/https://www.thetimes.com/
20250101,"Johnnie Walker, pioneering radio disc jockey, dies aged 79",https://web.archive.org/web/20250101234554/https://www.thetimes.com/
20250101,"Geoff Wheel, rugby player and chorister",https://web.archive.org/web/20250101234554/https://www.thetimes.com/
20250101,"Alfa Anderson, singer best known for Chic’s Le Freak",https://web.archive.org/web/20250101234554/https://www.thetimes.com/
20250101,"Olivia Hussey, angst-filled actress best known for Romeo and Juliet film",https://web.archive.org/web/20250101234554/https://www.thetimes.com/
20250101,The unlikely leader who became ‘best ex-president America ever had’,https://web.archive.org/web/20250101234554/https://www.thetimes.com/
20250101,Borders between countries are shifting due to climate change,https://web.archive.org/web/20250101234554/https://www.thetimes.com/
