fecha,titular,url_archivo
20250208,George Osborne’s family firm blames cost of living for £1.9m loss,https://web.archive.org/web/20250208235525/https://www.thetimes.com/
20250208,The Times Enterprise Network,https://web.archive.org/web/20250208235525/https://www.thetimes.com/
20250208,Nine in ten businesses are struggling to fill skills gaps,https://web.archive.org/web/20250208235525/https://www.thetimes.com/
20250208,Record demand for top apprenticeships as funding changes loom,https://web.archive.org/web/20250208235525/https://www.thetimes.com/
20250208,Banks to install coin ATMs in communities hit by closures,https://web.archive.org/web/20250208235525/https://www.thetimes.com/
20250208,Should I cut my middle managers to save money?,https://web.archive.org/web/20250208235525/https://www.thetimes.com/
20250208,What I learnt … landing my first employment contract at 64,https://web.archive.org/web/20250208235525/https://www.thetimes.com/
20250208,Governance specialists step out from the shadows,https://web.archive.org/web/20250208235525/https://www.thetimes.com/
20250208,‘Networking is just building relationships to cherish’,https://web.archive.org/web/20250208235525/https://www.thetimes.com/
20250208,Sport,https://web.archive.org/web/20250208235525/https://www.thetimes.com/
20250208,Daly’s last-gasp try gives England an epic win at last,https://web.archive.org/web/20250208235525/https://www.thetimes.com/
20250208,Outclassed and out of ideas: Wales facing wooden spoon after Italy loss,https://web.archive.org/web/20250208235525/https://www.thetimes.com/
20250208,Fin settles the Smith debate after 15 ice-cold minutes,https://web.archive.org/web/20250208235525/https://www.thetimes.com/
20250208,Mitoma’s moment of magic dumps toothless Chelsea out of FA Cup,https://web.archive.org/web/20250208235525/https://www.thetimes.com/
20250208,England showed killer instinct at last – now they have to kick on,https://web.archive.org/web/20250208235525/https://www.thetimes.com/
20250208,United might as well target Mars rather than a 21st title by 2028,https://web.archive.org/web/20250208235525/https://www.thetimes.com/
20250208,Chaos v control: How teams are upsetting the Guardiola school of tactics,https://web.archive.org/web/20250208235525/https://www.thetimes.com/
20250208,"Irish boxer Cooney, 28, dies a week after title fight",https://web.archive.org/web/20250208235525/https://www.thetimes.com/
20250208,Willock’s controversial double puts Birmingham’s big ambitions on ice,https://web.archive.org/web/20250208235525/https://www.thetimes.com/
20250208,Leeds condemn ‘vile’ tragedy chants from Millwall fans during defeat,https://web.archive.org/web/20250208235525/https://www.thetimes.com/
20250208,Ainslie has stomach for another America’s Cup fight – but does Sir Jim?,https://web.archive.org/web/20250208235525/https://www.thetimes.com/
20250208,Plymouth star who played with Gerrard and was scouted by Rooney,https://web.archive.org/web/20250208235525/https://www.thetimes.com/
20250208,Inside the secret world of modern football agents,https://web.archive.org/web/20250208235525/https://www.thetimes.com/
20250208,City avoid humiliation after recovering from 45-yard Orient wondergoal,https://web.archive.org/web/20250208235525/https://www.thetimes.com/
20250208,Martinelli out for more than a month with hamstring injury,https://web.archive.org/web/20250208235525/https://www.thetimes.com/
20250208,Slick Bournemouth make Tarkowski pay in final Goodison cup tie,https://web.archive.org/web/20250208235525/https://www.thetimes.com/
20250208,‘Unthinkable and unacceptable’ — Van Nistelrooy fumes at offside error,https://web.archive.org/web/20250208235525/https://www.thetimes.com/
20250208,Rob Wright’s Saturday racing tips,https://web.archive.org/web/20250208235525/https://www.thetimes.com/
20250208,How Sheehan went from playing for free at Leinster to walking into World XV,https://web.archive.org/web/20250208235525/https://www.thetimes.com/
20250208,Jordan picked as foil to Russell as Scotland lean on pace to end Ireland rut,https://web.archive.org/web/20250208235525/https://www.thetimes.com/
20250208,Super Bowl LIX,https://web.archive.org/web/20250208235525/https://www.thetimes.com/
20250208,Eagles denied Brady three-peat — can they ruin Chiefs’ shot at history?,https://web.archive.org/web/20250208235525/https://www.thetimes.com/
20250208,How Super Bowl half-time shows became more popular than match itself,https://web.archive.org/web/20250208235525/https://www.thetimes.com/
20250208,Super Bowl fever arrives at London’s own ‘Philadelphia dive bar’,https://web.archive.org/web/20250208235525/https://www.thetimes.com/
20250208,Age-defying Brady to elated Swift: Super Bowl history in pictures,https://web.archive.org/web/20250208235525/https://www.thetimes.com/
20250208,Sponsored,https://web.archive.org/web/20250208235525/https://www.thetimes.com/
20250208,Money,https://web.archive.org/web/20250208235525/https://www.thetimes.com/
20250208,Mortgage rate relief for homeowners at last,https://web.archive.org/web/20250208235525/https://www.thetimes.com/
20250208,Why playing FTSE beats those sexy tech stocks,https://web.archive.org/web/20250208235525/https://www.thetimes.com/
20250208,Beat the clock to boost your state pension,https://web.archive.org/web/20250208235525/https://www.thetimes.com/
20250208,Welcome to life in the towns without banks,https://web.archive.org/web/20250208235525/https://www.thetimes.com/
20250208,Should families get a stamp duty break?,https://web.archive.org/web/20250208235525/https://www.thetimes.com/
20250208,"I don’t owe Virgin Media £723, but it won’t stop hounding me",https://web.archive.org/web/20250208235525/https://www.thetimes.com/
20250208,"Should I invest my £50,000 payout or clear my debt?",https://web.archive.org/web/20250208235525/https://www.thetimes.com/
20250208,The Times Magazine,https://web.archive.org/web/20250208235525/https://www.thetimes.com/
20250208,Boris Becker: I lost literally everything — but survived prison,https://web.archive.org/web/20250208235525/https://www.thetimes.com/
20250208,Elizabeth Day: My toxic dating disasters and how I met the One,https://web.archive.org/web/20250208235525/https://www.thetimes.com/
20250208,I went on a posh magic mushroom retreat. Here’s what I learnt,https://web.archive.org/web/20250208235525/https://www.thetimes.com/
20250208,"William, Andrew, Kate and Meghan: what the palace staff saw",https://web.archive.org/web/20250208235525/https://www.thetimes.com/
20250208,Why Gen Z will never have as good a life as me,https://web.archive.org/web/20250208235525/https://www.thetimes.com/
20250208,What it’s like to be in an open marriage: ‘Secrets are dangerous’,https://web.archive.org/web/20250208235525/https://www.thetimes.com/
20250208,Mobo founder Kanya King: My terminal cancer isn’t my destiny,https://web.archive.org/web/20250208235525/https://www.thetimes.com/
20250208,"Christian Louboutin on heels, Taylor Swift and why he hates Crocs",https://web.archive.org/web/20250208235525/https://www.thetimes.com/
20250208,Animal print is still in for spring (and six other hot trends),https://web.archive.org/web/20250208235525/https://www.thetimes.com/
20250208,French recipes for Valentine’s Day. Serve with love,https://web.archive.org/web/20250208235525/https://www.thetimes.com/
20250208,The food editor’s top Valentine’s Day cook at home meal deals,https://web.archive.org/web/20250208235525/https://www.thetimes.com/
20250208,"Don’t Tell Dad review — ‘A good, ever changing menu’",https://web.archive.org/web/20250208235525/https://www.thetimes.com/
20250208,Ten minutes of the nurse’s magic pump and life’s good again,https://web.archive.org/web/20250208235525/https://www.thetimes.com/
20250208,Luxx Report,https://web.archive.org/web/20250208235525/https://www.thetimes.com/
20250208,Panama’s perfect private island: welcome to Islas Secas,https://web.archive.org/web/20250208235525/https://www.thetimes.com/
20250208,Eleuthera’s legendary Potlatch Club is back in business,https://web.archive.org/web/20250208235525/https://www.thetimes.com/
20250208,The Anguilla beach house where Beyoncé and Adele chill out,https://web.archive.org/web/20250208235525/https://www.thetimes.com/
20250208,"Luxury travel updates for 2025, from Venice to Rome",https://web.archive.org/web/20250208235525/https://www.thetimes.com/
20250208,Amsterdam is blooming: the best new hotels and places to eat,https://web.archive.org/web/20250208235525/https://www.thetimes.com/
20250208,The Brando review: where A-listers pretend to be shipwrecked,https://web.archive.org/web/20250208235525/https://www.thetimes.com/
20250208,Príncipe transformed: a taste of paradise on a rainforest island,https://web.archive.org/web/20250208235525/https://www.thetimes.com/
20250208,Mnemba: a desert island to call your own (if only for a few days),https://web.archive.org/web/20250208235525/https://www.thetimes.com/
20250208,Ritz-Carlton’s latest venture? The ultimate luxury cruise ship,https://web.archive.org/web/20250208235525/https://www.thetimes.com/
20250208,Brazil’s hottest secret: the lagoons of Lencois Maranhenses,https://web.archive.org/web/20250208235525/https://www.thetimes.com/
20250208,Saturday Review,https://web.archive.org/web/20250208235525/https://www.thetimes.com/
20250208,"Meet the White Lotus series 3 cast: ‘It’s a big, dark, beautiful symphony’",https://web.archive.org/web/20250208235525/https://www.thetimes.com/
20250208,Why Louis Walsh’s reputation may not survive this Boyzone exposé,https://web.archive.org/web/20250208235525/https://www.thetimes.com/
20250208,The Life of Donald Trump by Gaius Suetonius Tranquillus (aka Tom Holland),https://web.archive.org/web/20250208235525/https://www.thetimes.com/
20250208,"Bono’s son’s band, Inhaler: ‘None of us has moved out of our childhood homes’",https://web.archive.org/web/20250208235525/https://www.thetimes.com/
20250208,Jonathan Sumption: ‘I’m not optimistic about the future of our democracy’,https://web.archive.org/web/20250208235525/https://www.thetimes.com/
20250208,Advice for parents of teens — don’t bang on about mental health,https://web.archive.org/web/20250208235525/https://www.thetimes.com/
20250208,Refugee to riches: the brash billionaire who took on Beijing (and is now in jail),https://web.archive.org/web/20250208235525/https://www.thetimes.com/
20250208,Erin Doherty: We’re all supposed to read Nietzsche,https://web.archive.org/web/20250208235525/https://www.thetimes.com/
20250208,Going out or staying in? Our critics pick the best things to do this week,https://web.archive.org/web/20250208235525/https://www.thetimes.com/
20250208,"10 best TV detective duos, ranked by our critic",https://web.archive.org/web/20250208235525/https://www.thetimes.com/
20250208,What’s on TV and radio this weekend — Live Six Nations,https://web.archive.org/web/20250208235525/https://www.thetimes.com/
20250208,Tragedy and camaraderie — the story of Britain’s last miners,https://web.archive.org/web/20250208235525/https://www.thetimes.com/
20250208,It’s Benidorm noir — the hunt for Reggie Kray’s Dunhill lighter,https://web.archive.org/web/20250208235525/https://www.thetimes.com/
20250208,"Bribery, bias and groupthink: why doctors get it wrong",https://web.archive.org/web/20250208235525/https://www.thetimes.com/
20250208,New popular fiction — my boyfriend is a blob: time to shape him,https://web.archive.org/web/20250208235525/https://www.thetimes.com/
20250208,"Sex, magic, surrealism: why it’s time to rediscover Ithell Colquhoun",https://web.archive.org/web/20250208235525/https://www.thetimes.com/
20250208,"A shocking tale about the Troubles, sensitively told",https://web.archive.org/web/20250208235525/https://www.thetimes.com/
20250208,"Most debut novels are ho-hum, but this one is gosh-wow",https://web.archive.org/web/20250208235525/https://www.thetimes.com/
20250208,Lawrence Durrell’s Alexandria Quartet is pretentious — but what fun,https://web.archive.org/web/20250208235525/https://www.thetimes.com/
20250208,The best new songs to listen to this week,https://web.archive.org/web/20250208235525/https://www.thetimes.com/
20250208,The latest news and gossip from the world of TV,https://web.archive.org/web/20250208235525/https://www.thetimes.com/
20250208,The best books of 2025 so far — our critics’ picks,https://web.archive.org/web/20250208235525/https://www.thetimes.com/
20250208,‘This ball’s on fire better sound the alarm’ – a girl who wants to be a baseball star,https://web.archive.org/web/20250208235525/https://www.thetimes.com/
20250208,First night reviews,https://web.archive.org/web/20250208235525/https://www.thetimes.com/
20250208,This London-bound Semele has a shock finale,https://web.archive.org/web/20250208235525/https://www.thetimes.com/
20250208,Caribou — five-star dancefloor joy from the boffin-producer,https://web.archive.org/web/20250208235525/https://www.thetimes.com/
20250208,Stewart Lee — hail the most stimulating stand-up of the 21st century,https://web.archive.org/web/20250208235525/https://www.thetimes.com/
20250208,Hidden — a cast pushed to their limits in an acrobatic drama,https://web.archive.org/web/20250208235525/https://www.thetimes.com/
20250208,"Welsh culture is in crisis, but this Marriage of Figaro is a beacon of hope",https://web.archive.org/web/20250208235525/https://www.thetimes.com/
20250208,Clang! The machines take over in Olga Neuwirth’s percussion concerto,https://web.archive.org/web/20250208235525/https://www.thetimes.com/
20250208,What to watch: your TV and streaming guide,https://web.archive.org/web/20250208235525/https://www.thetimes.com/
20250208,The best hidden gem TV shows,https://web.archive.org/web/20250208235525/https://www.thetimes.com/
20250208,The best shows on Netflix,https://web.archive.org/web/20250208235525/https://www.thetimes.com/
20250208,The best shows on Channel 4 streaming,https://web.archive.org/web/20250208235525/https://www.thetimes.com/
20250208,The best shows on Sky and Now,https://web.archive.org/web/20250208235525/https://www.thetimes.com/
20250208,Can Elon Musk Rule the World? review — motivation of a super-ego,https://web.archive.org/web/20250208235525/https://www.thetimes.com/
20250208,The best shows on Apple TV+,https://web.archive.org/web/20250208235525/https://www.thetimes.com/
20250208,The best shows on ITVX,https://web.archive.org/web/20250208235525/https://www.thetimes.com/
20250208,The best shows on Paramount+,https://web.archive.org/web/20250208235525/https://www.thetimes.com/
20250208,TV listings,https://web.archive.org/web/20250208235525/https://www.thetimes.com/
20250208,"The Times Saturday Quiz: February 8, 2025",https://web.archive.org/web/20250208235525/https://www.thetimes.com/
20250208,Word Watch,https://web.archive.org/web/20250208235525/https://www.thetimes.com/
20250208,Mindset,https://web.archive.org/web/20250208235525/https://www.thetimes.com/
20250208,Knockout! Why we’re staging Wagner’s Ring in an East End boxing ring,https://web.archive.org/web/20250208235525/https://www.thetimes.com/
20250208,Weekend,https://web.archive.org/web/20250208235525/https://www.thetimes.com/
20250208,I was an anxious midlife man. What happened when I took antidepressants?,https://web.archive.org/web/20250208235525/https://www.thetimes.com/
20250208,Antidepressants: what you need to know,https://web.archive.org/web/20250208235525/https://www.thetimes.com/
20250208,The 9 secrets of happy long-term relationships,https://web.archive.org/web/20250208235525/https://www.thetimes.com/
20250208,The best pink wines for Valentine’s Day,https://web.archive.org/web/20250208235525/https://www.thetimes.com/
20250208,What top chefs eat after a shift: the speediest midnight snacks,https://web.archive.org/web/20250208235525/https://www.thetimes.com/
20250208,How to be a good grandparent without falling out with your children,https://web.archive.org/web/20250208235525/https://www.thetimes.com/
20250208,How to hit peak fitness over 40: the midlife rules,https://web.archive.org/web/20250208235525/https://www.thetimes.com/
20250208,I don’t want to share a bedroom with my new man,https://web.archive.org/web/20250208235525/https://www.thetimes.com/
20250208,"My 5,000-mile run around Britain",https://web.archive.org/web/20250208235525/https://www.thetimes.com/
20250208,AI garden design? I asked ChatGPT what robots can do for me,https://web.archive.org/web/20250208235525/https://www.thetimes.com/
20250208,"A good walk: Wicken Fen, Cambridgeshire",https://web.archive.org/web/20250208235525/https://www.thetimes.com/
20250208,My top flowering plants for colour now,https://web.archive.org/web/20250208235525/https://www.thetimes.com/
20250208,The UK’s most romantic places to stay in 2025,https://web.archive.org/web/20250208235525/https://www.thetimes.com/
20250208,Travel,https://web.archive.org/web/20250208235525/https://www.thetimes.com/
20250208,"I’ve been to every country in the world — these are the best, and worst",https://web.archive.org/web/20250208235525/https://www.thetimes.com/
20250208,How these chic new holiday cottages are reviving a quaint Devon village,https://web.archive.org/web/20250208235525/https://www.thetimes.com/
20250208,The exciting hotel that’s bringing belle époque glam back to Brussels,https://web.archive.org/web/20250208235525/https://www.thetimes.com/
20250208,‘My flight was aborted and Ryanair promised a free flight — then refused’,https://web.archive.org/web/20250208235525/https://www.thetimes.com/
20250208,The best late deals to book now from Oman to the Jurassic Coast,https://web.archive.org/web/20250208235525/https://www.thetimes.com/
20250208,When fashion met travel: the most stylish new riad in Marrakesh,https://web.archive.org/web/20250208235525/https://www.thetimes.com/
20250208,14 of the best affordable hotels in Spain for under £150,https://web.archive.org/web/20250208235525/https://www.thetimes.com/
20250208,Matthew Parris: Why I decided to go it alone in Zimbabwe,https://web.archive.org/web/20250208235525/https://www.thetimes.com/
20250208,12 of the best Alaska cruises for an awe-inspiring trip,https://web.archive.org/web/20250208235525/https://www.thetimes.com/
20250208,Cappadocia’s most atmospheric hotels,https://web.archive.org/web/20250208235525/https://www.thetimes.com/
20250208,Manor House Inn review: a starry posh pub with rooms in Bruton,https://web.archive.org/web/20250208235525/https://www.thetimes.com/
20250208,I grew up in Spain. These are its 25 top spots for a beach holiday,https://web.archive.org/web/20250208235525/https://www.thetimes.com/
20250208,This is one of Italy’s loveliest cities for a spring break,https://web.archive.org/web/20250208235525/https://www.thetimes.com/
20250208,Register,https://web.archive.org/web/20250208235525/https://www.thetimes.com/
20250208,"Barbara Maxwell, BBC producer who created Question Time",https://web.archive.org/web/20250208235525/https://www.thetimes.com/
20250208,"Pete Wilkinson, Greenpeace UK’s first director",https://web.archive.org/web/20250208235525/https://www.thetimes.com/
20250208,"Christopher Sinclair-Stevenson, publisher and literary agent",https://web.archive.org/web/20250208235525/https://www.thetimes.com/
20250208,"Aga Khan, billionaire philanthropist and friend of the Queen",https://web.archive.org/web/20250208235525/https://www.thetimes.com/
20250208,Times obituaries brought to life in a podcast,https://web.archive.org/web/20250208235525/https://www.thetimes.com/
20250208,From the archive: Whales driven to the brink,https://web.archive.org/web/20250208235525/https://www.thetimes.com/
20250208,‘The devil’s footprints’ seen after heavy snowfall in Devon,https://web.archive.org/web/20250208235525/https://www.thetimes.com/
20250208,Read the synod small print: parish funding could be cut,https://web.archive.org/web/20250208235525/https://www.thetimes.com/
20250208,"Births, marriages and deaths",https://web.archive.org/web/20250208235525/https://www.thetimes.com/
20250208,"The Times Saturday Quiz: February 8, 2025",https://web.archive.org/web/20250208235525/https://www.thetimes.com/
20250208,Court Circular,https://web.archive.org/web/20250208235525/https://www.thetimes.com/
20250208,Readers' Lives,https://web.archive.org/web/20250208235525/https://www.thetimes.com/
20250208,Readers’ lives: weddings,https://web.archive.org/web/20250208235525/https://www.thetimes.com/
20250208,New reader: James Thomas MacCarthy-Morrogh,https://web.archive.org/web/20250208235525/https://www.thetimes.com/
20250208,Puzzles,https://web.archive.org/web/20250208235525/https://www.thetimes.com/
20250208,Crossword Club,https://web.archive.org/web/20250208235525/https://www.thetimes.com/
20250208,Times Concise No 9762,https://web.archive.org/web/20250208235525/https://www.thetimes.com/
20250208,Times Quick Cryptic No 2907,https://web.archive.org/web/20250208235525/https://www.thetimes.com/
20250208,Times Cryptic No 29148,https://web.archive.org/web/20250208235525/https://www.thetimes.com/
20250208,Times Cryptic Jumbo No 1716,https://web.archive.org/web/20250208235525/https://www.thetimes.com/
20250208,Times Concise Jumbo 1716,https://web.archive.org/web/20250208235525/https://www.thetimes.com/
20250208,O Tempora! CDLXXXVIII,https://web.archive.org/web/20250208235525/https://www.thetimes.com/
20250208,Concise Quintagram No 2173,https://web.archive.org/web/20250208235525/https://www.thetimes.com/
20250208,Cryptic Quintagram No 2173,https://web.archive.org/web/20250208235525/https://www.thetimes.com/
20250208,Sudoku No 15608 Fiendish,https://web.archive.org/web/20250208235525/https://www.thetimes.com/
20250208,Sudoku No 15607 Difficult,https://web.archive.org/web/20250208235525/https://www.thetimes.com/
20250208,Sudoku No 15606 Easy,https://web.archive.org/web/20250208235525/https://www.thetimes.com/
20250208,Killer Sudoku No 9931 Deadly,https://web.archive.org/web/20250208235525/https://www.thetimes.com/
20250208,Killer Sudoku No 9930 Moderate,https://web.archive.org/web/20250208235525/https://www.thetimes.com/
20250208,Brain Trainer No 4677,https://web.archive.org/web/20250208235525/https://www.thetimes.com/
20250208,Cell Blocks No 5329,https://web.archive.org/web/20250208235525/https://www.thetimes.com/
20250208,Codeword No 5446,https://web.archive.org/web/20250208235525/https://www.thetimes.com/
20250208,Futoshiki No 4986,https://web.archive.org/web/20250208235525/https://www.thetimes.com/
20250208,Kakuro No 3945,https://web.archive.org/web/20250208235525/https://www.thetimes.com/
20250208,KenKen No 6438,https://web.archive.org/web/20250208235525/https://www.thetimes.com/
20250208,Lexica No 7949 Easy,https://web.archive.org/web/20250208235525/https://www.thetimes.com/
20250208,Lexica No 7950 Hard,https://web.archive.org/web/20250208235525/https://www.thetimes.com/
20250208,Polygon,https://web.archive.org/web/20250208235525/https://www.thetimes.com/
20250208,Set Square No 3948,https://web.archive.org/web/20250208235525/https://www.thetimes.com/
20250208,Square Routes No 310,https://web.archive.org/web/20250208235525/https://www.thetimes.com/
20250208,Suko No 4347,https://web.archive.org/web/20250208235525/https://www.thetimes.com/
20250208,Bridge,https://web.archive.org/web/20250208235525/https://www.thetimes.com/
20250208,Chess,https://web.archive.org/web/20250208235525/https://www.thetimes.com/
20250208,Scrabble®,https://web.archive.org/web/20250208235525/https://www.thetimes.com/
20250208,Puzzles Puff,https://web.archive.org/web/20250208235525/https://www.thetimes.com/
20250208,The Times Saturday Quiz,https://web.archive.org/web/20250208235525/https://www.thetimes.com/
20250208,Mindset by 700,https://web.archive.org/web/20250208235525/https://www.thetimes.com/
20250208,Printable Puzzles,https://web.archive.org/web/20250208235525/https://www.thetimes.com/
20250208,Scotland,https://web.archive.org/web/20250208235525/https://www.thetimes.com/
20250208,"How one Tory MSP’s ‘AI’ questions cost taxpayers £100,000 — in a month",https://web.archive.org/web/20250208235525/https://www.thetimes.com/
20250208,Why Swinney sidelined his health minister to boost SNP election hopes,https://web.archive.org/web/20250208235525/https://www.thetimes.com/
20250208,‘There’s always going to be a sexual element’: Furries come out to cosplay in Glasgow,https://web.archive.org/web/20250208235525/https://www.thetimes.com/
20250208,"‘Nobody wins a trade war’: In Scotland, whisky makers brace for tariffs",https://web.archive.org/web/20250208235525/https://www.thetimes.com/
20250208,"Teaching, travelling and afternoon naps: what ousted SNP MPs did next",https://web.archive.org/web/20250208235525/https://www.thetimes.com/
20250208,Glen Sannox out of action weeks after entering service,https://web.archive.org/web/20250208235525/https://www.thetimes.com/
20250208,What life was like in the dying days of an independent Scotland,https://web.archive.org/web/20250208235525/https://www.thetimes.com/
20250208,Briton killed in France was organised crime financial investigator,https://web.archive.org/web/20250208235525/https://www.thetimes.com/
20250208,Health board ‘withheld documents’ in trans doctor tribunal,https://web.archive.org/web/20250208235525/https://www.thetimes.com/
20250208,"Former council leader denies £188,000 ‘romance fraud’",https://web.archive.org/web/20250208235525/https://www.thetimes.com/
20250208,"Tom Daley cheers widow with surprise message on 5,000-mile walk",https://web.archive.org/web/20250208235525/https://www.thetimes.com/
20250208,Glasgow schools to close as teachers strike,https://web.archive.org/web/20250208235525/https://www.thetimes.com/
